[
  {
    "Id": "68357f3e790d8280c4b20006",
    "Name": "King",
    "Type": "Profile",
    "BaseId": "5",
    "Children": [
      {
        "Id": "statline_325"
      },
      {
        "Id": "statline_326"
      },
      {
        "Id": "statline_327"
      }
    ]
  },
  {
    "Id": "ae8b8657-432d-4387-8eb8-ac492b856eb6",
    "Name": "King on Shield Bearers",
    "Type": "Profile",
    "BaseId": "13",
    "Children": [
      {
        "Id": "statline_328"
      },
      {
        "Id": "statline_329"
      },
      {
        "Id": "statline_327"
      },
      {
        "Id": "statline_330"
      }
    ]
  },
  {
    "Id": "da4bc9e1-5418-48d9-a7d6-a11644d236d1",
    "Name": "King on War Throne",
    "Type": "Profile",
    "BaseId": "9",
    "Children": [
      {
        "Id": "statline_331"
      },
      {
        "Id": "statline_332"
      },
      {
        "Id": "statline_327"
      },
      {
        "Id": "statline_333"
      }
    ]
  },
  {
    "Id": "68357f3e790d8280c4b200b7",
    "Name": "Thane",
    "Type": "Profile",
    "BaseId": "5",
    "Children": [
      {
        "Id": "statline_334"
      },
      {
        "Id": "statline_335"
      },
      {
        "Id": "statline_336"
      }
    ]
  },
  {
    "Id": "dd537738-5c32-4a1c-9880-eeb3a4d7555b",
    "Name": "Thane on Shield Bearers",
    "Type": "Profile",
    "BaseId": "13",
    "Children": [
      {
        "Id": "statline_337"
      },
      {
        "Id": "statline_338"
      },
      {
        "Id": "statline_336"
      },
      {
        "Id": "statline_330"
      }
    ]
  },
  {
    "Id": "68357f3f790d8280c4b20169",
    "Name": "Runic Smith",
    "Type": "Profile",
    "BaseId": "5",
    "Children": [
      {
        "Id": "statline_339"
      },
      {
        "Id": "statline_340"
      },
      {
        "Id": "statline_341"
      }
    ]
  },
  {
    "Id": "68357f3f790d8280c4b2019a",
    "Name": "Engineer",
    "Type": "Profile",
    "BaseId": "5",
    "Children": [
      {
        "Id": "statline_342"
      },
      {
        "Id": "statline_343"
      },
      {
        "Id": "statline_344"
      }
    ]
  },
  {
    "Id": "68357f3f790d8280c4b20150",
    "Name": "Dragon Seeker",
    "Type": "Profile",
    "BaseId": "5",
    "Children": [
      {
        "Id": "statline_345"
      },
      {
        "Id": "statline_346"
      },
      {
        "Id": "statline_347"
      }
    ]
  },
  {
    "Id": "f3e9b1a8d2c4e7b5f9a2d6b1f3d",
    "Name": "Duna Bregold, Master of the Guild of Lorekeepers",
    "Type": "Profile",
    "BaseId": "1",
    "Children": [
      {
        "Id": "statline_348"
      },
      {
        "Id": "statline_349"
      },
      {
        "Id": "statline_350"
      },
      {
        "Id": "statline_351"
      }
    ]
  },
  {
    "Id": "f2d8c1b9a6e3f7a4c2d1b9f5d7b",
    "Name": "Brewmaster Tador Berafrig",
    "Type": "Profile",
    "BaseId": "5",
    "Children": [
      {
        "Id": "statline_352"
      },
      {
        "Id": "statline_353"
      },
      {
        "Id": "statline_354"
      }
    ]
  },
  {
    "Id": "68357f3f790d8280c4b201d3",
    "Name": "Clan Warriors",
    "Type": "Profile",
    "BaseId": "5",
    "Children": [
      {
        "Id": "statline_355"
      },
      {
        "Id": "statline_356"
      },
      {
        "Id": "statline_357"
      }
    ]
  },
  {
    "Id": "68357f3f790d8280c4b20236",
    "Name": "Greybeards",
    "Type": "Profile",
    "BaseId": "5",
    "Children": [
      {
        "Id": "statline_358"
      },
      {
        "Id": "statline_359"
      },
      {
        "Id": "statline_360"
      }
    ]
  },
  {
    "Id": "68357f40790d8280c4b20293",
    "Name": "Clan Marksmen",
    "Type": "Profile",
    "BaseId": "5",
    "Children": [
      {
        "Id": "statline_361"
      },
      {
        "Id": "statline_362"
      },
      {
        "Id": "statline_363"
      }
    ]
  },
  {
    "Id": "68357f40790d8280c4b2033d",
    "Name": "King's Guard",
    "Type": "Profile",
    "BaseId": "5",
    "Children": [
      {
        "Id": "statline_364"
      },
      {
        "Id": "statline_365"
      },
      {
        "Id": "statline_366"
      }
    ]
  },
  {
    "Id": "68357f40790d8280c4b202f0",
    "Name": "Deep Watch",
    "Type": "Profile",
    "BaseId": "5",
    "Children": [
      {
        "Id": "statline_367"
      },
      {
        "Id": "statline_368"
      },
      {
        "Id": "statline_369"
      }
    ]
  },
  {
    "Id": "68357f41790d8280c4b203b2",
    "Name": "Seekers",
    "Type": "Profile",
    "BaseId": "5",
    "Children": [
      {
        "Id": "statline_370"
      },
      {
        "Id": "statline_371"
      },
      {
        "Id": "statline_372"
      }
    ]
  },
  {
    "Id": "68357f41790d8280c4b203ec",
    "Name": "Vengeance Seeker",
    "Type": "Profile",
    "BaseId": "5",
    "Children": [
      {
        "Id": "statline_373"
      },
      {
        "Id": "statline_374"
      },
      {
        "Id": "statline_375"
      }
    ]
  },
  {
    "Id": "68357f41790d8280c4b203ef",
    "Name": "Hold Guardians",
    "Type": "Profile",
    "BaseId": "4",
    "Children": [
      {
        "Id": "statline_376"
      },
      {
        "Id": "statline_377"
      },
      {
        "Id": "statline_378"
      }
    ]
  },
  {
    "Id": "68357f42790d8280c4b20438",
    "Name": "Grudge Buster",
    "Type": "Profile",
    "BaseId": "2",
    "Children": [
      {
        "Id": "statline_379"
      },
      {
        "Id": "statline_380"
      },
      {
        "Id": "statline_381"
      },
      {
        "Id": "statline_382"
      }
    ]
  },
  {
    "Id": "68357f41790d8280c4b20388",
    "Name": "Miners",
    "Type": "Profile",
    "BaseId": "5",
    "Children": [
      {
        "Id": "statline_383"
      },
      {
        "Id": "statline_384"
      },
      {
        "Id": "statline_385"
      }
    ]
  },
  {
    "Id": "68357f40790d8280c4b20339",
    "Name": "Anvil of Power",
    "Type": "Profile",
    "BaseId": "11",
    "Children": [
      {
        "Id": "statline_386"
      },
      {
        "Id": "statline_387"
      },
      {
        "Id": "statline_388"
      }
    ]
  },
  {
    "Id": "68357f42790d8280c4b204c6",
    "Name": "Rangers",
    "Type": "Profile",
    "BaseId": "5",
    "Children": [
      {
        "Id": "statline_389"
      },
      {
        "Id": "statline_390"
      },
      {
        "Id": "statline_391"
      }
    ]
  },
  {
    "Id": "68357f42790d8280c4b204f9",
    "Name": "Forge Wardens",
    "Type": "Profile",
    "BaseId": "5",
    "Children": [
      {
        "Id": "statline_392"
      },
      {
        "Id": "statline_393"
      },
      {
        "Id": "statline_394"
      }
    ]
  },
  {
    "Id": "68357f43790d8280c4b20544",
    "Name": "Steam Copters",
    "Type": "Profile",
    "BaseId": "4",
    "Children": [
      {
        "Id": "statline_395"
      },
      {
        "Id": "statline_396"
      },
      {
        "Id": "statline_397"
      }
    ]
  },
  {
    "Id": "68357f42790d8280c4b20439",
    "Name": "Field Artillery",
    "Type": "Profile",
    "BaseId": "11",
    "Children": [
      {
        "Id": "statline_398"
      },
      {
        "Id": "statline_399"
      },
      {
        "Id": "statline_400"
      }
    ]
  }
]