[
  {
    "Id": "profile_1764962748049",
    "Name": "Shrine Guards",
    "Type": "Profile",
    "BaseId": "4",
    "Children": [
      {
        "Id": "statline_267"
      },
      {
        "Id": "883e-e1b1-4fe9-5912"
      },
      {
        "Id": "233a-1715-82be-1410"
      },
      {
        "Id": "2e16-e293-353e-6881"
      },
      {
        "Id": "rule_1764963425805",
        "Info": "(Orcs & Goblins)"
      },
      {
        "Id": "93d9-c75b-f655-30ac"
      },
      {
        "Id": "2ecd-c6b3-bd8b-864b"
      },
      {
        "Id": "90ed-c9be-a611-79cc",
        "Info": "(-2)"
      },
      {
        "Id": "6359-4018-5cd4-3720"
      },
      {
        "Id": "a230-c540-6a65-4974"
      },
      {
        "Id": "ea84-d53c-ef3b-57e8"
      },
      {
        "Id": "d3eb-1fa0-bb19-f390"
      }
    ]
  },
  {
    "Id": "profile_1764962888457",
    "Name": "Shrine Keeper (Shrine Guard)",
    "Type": "Profile",
    "BaseId": "4",
    "Children": [
      {
        "Id": "statline_268"
      },
      {
        "Id": "rule_1764962969839"
      },
      {
        "Id": "883e-e1b1-4fe9-5912"
      },
      {
        "Id": "233a-1715-82be-1410"
      },
      {
        "Id": "2e16-e293-353e-6881"
      },
      {
        "Id": "rule_1764963425805",
        "Info": "(Orcs & Goblins)"
      },
      {
        "Id": "93d9-c75b-f655-30ac"
      },
      {
        "Id": "2ecd-c6b3-bd8b-864b"
      },
      {
        "Id": "90ed-c9be-a611-79cc",
        "Info": "(-2)"
      },
      {
        "Id": "6359-4018-5cd4-3720"
      },
      {
        "Id": "a230-c540-6a65-4974"
      },
      {
        "Id": "ea84-d53c-ef3b-57e8"
      },
      {
        "Id": "d3eb-1fa0-bb19-f390"
      }
    ]
  },
  {
    "Id": "68357b496d966c2c1468473a",
    "Name": "Ungrim Ironfist",
    "Type": "Profile",
    "BaseId": "4",
    "Children": [
      {
        "Id": "statline_211"
      },
      {
        "Id": "233a-1715-82be-1410"
      },
      {
        "Id": "1a10-9069-8ff3-84ef"
      },
      {
        "Id": "f4b3-18af-16bf-78dd",
        "Info": "(Orcs & Goblins)"
      },
      {
        "Id": "93d9-c75b-f655-30ac"
      },
      {
        "Id": "73d0-308c-917f-84c0"
      },
      {
        "Id": "90ed-c9be-a611-79cc",
        "Info": "(-2)"
      },
      {
        "Id": "23c4-bd19-2422-ad08"
      },
      {
        "Id": "a230-c540-6a65-4974"
      },
      {
        "Id": "ea84-d53c-ef3b-57e8"
      },
      {
        "Id": "d3eb-1fa0-bb19-f390"
      },
      {
        "Id": "6d4a-7733-d725-a267"
      },
      {
        "Id": "dbb2-4d85-84c2-528c"
      },
      {
        "Id": "1c85-693f-e00f-9a3d"
      },
      {
        "Id": "1dff-4744-d20c-13be"
      }
    ]
  },
  {
    "Id": "68357b4d6d966c2c1468abd6",
    "Name": "Doomseeker",
    "Type": "Profile",
    "BaseId": "4",
    "Children": [
      {
        "Id": "statline_100"
      },
      {
        "Id": "233a-1715-82be-1410"
      },
      {
        "Id": "74e5-b4c9-5ca9-6ca2"
      },
      {
        "Id": "8961-ff44-72ad-9de1"
      },
      {
        "Id": "2e16-e293-353e-6881"
      },
      {
        "Id": "f4b3-18af-16bf-78dd",
        "Info": "(Orcs & Goblins)"
      },
      {
        "Id": "93d9-c75b-f655-30ac"
      },
      {
        "Id": "5c2-e9dd-2715-a0c0",
        "Info": "(D3+1)"
      },
      {
        "Id": "2ecd-c6b3-bd8b-864b"
      },
      {
        "Id": "90ed-c9be-a611-79cc",
        "Info": "(-2)"
      },
      {
        "Id": "4d1b-2617-ebdc-4f4d"
      },
      {
        "Id": "1b08-4621-6379-ff1f"
      },
      {
        "Id": "a230-c540-6a65-4974"
      },
      {
        "Id": "d3eb-1fa0-bb19-f390"
      },
      {
        "Id": "691e-10ec-4f7c-a2c4"
      },
      {
        "Id": "133a-a421-c52f-e33f"
      },
      {
        "Id": "6d4a-7733-d725-a267"
      },
      {
        "Id": "59a5-7eca-ee35-96ac"
      }
    ]
  },
  {
    "Id": "68357b486d966c2c1467f9f1",
    "Name": "Veteran (Imperial Dwarf Warrior)",
    "Type": "Profile",
    "BaseId": "4",
    "Children": [
      {
        "Id": "statline_269"
      },
      {
        "Id": "883e-e1b1-4fe9-5912"
      },
      {
        "Id": "f4b3-18af-16bf-78dd",
        "Info": "(Orcs & Goblins)"
      },
      {
        "Id": "90ed-c9be-a611-79cc",
        "Info": "(-1)"
      },
      {
        "Id": "4d1b-2617-ebdc-4f4d"
      },
      {
        "Id": "a230-c540-6a65-4974"
      },
      {
        "Id": "32f7-8e30-3fe8-b11e"
      }
    ]
  },
  {
    "Id": "68357b406d966c2c1466eed0",
    "Name": "Prince Ulther Stonehammer",
    "Type": "Profile",
    "BaseId": "4",
    "Children": [
      {
        "Id": "statline_261"
      },
      {
        "Id": "883e-e1b1-4fe9-5912"
      },
      {
        "Id": "1f64-3ddc-db58-12fb"
      },
      {
        "Id": "2e16-e293-353e-6881"
      },
      {
        "Id": "f4b3-18af-16bf-78dd",
        "Info": "(Orcs & Goblins)"
      },
      {
        "Id": "90ed-c9be-a611-79cc",
        "Info": "(-1)"
      },
      {
        "Id": "4d1b-2617-ebdc-4f4d"
      },
      {
        "Id": "a230-c540-6a65-4974"
      },
      {
        "Id": "e351-bbd6-f470-b604"
      },
      {
        "Id": "3f0e-1dc6-b425-bf59"
      },
      {
        "Id": "f170-4b76-b645-29c4"
      },
      {
        "Id": "34c9-6f88-dcfd-d3fa"
      },
      {
        "Id": "6d4a-7733-d725-a267"
      },
      {
        "Id": "dbb2-4d85-84c2-528c"
      },
      {
        "Id": "ea58-1a09-e839-cced"
      },
      {
        "Id": "8997-c74d-3a8d-ecf9"
      }
    ]
  },
  {
    "Id": "68357b406d966c2c1466eec7",
    "Name": "Borri Forkbeard",
    "Type": "Profile",
    "BaseId": "4",
    "Children": [
      {
        "Id": "statline_262"
      },
      {
        "Id": "883e-e1b1-4fe9-5912"
      },
      {
        "Id": "1f64-3ddc-db58-12fb"
      },
      {
        "Id": "2e16-e293-353e-6881"
      },
      {
        "Id": "f4b3-18af-16bf-78dd",
        "Info": "(Orcs & Goblins)"
      },
      {
        "Id": "90ed-c9be-a611-79cc",
        "Info": "(-1)"
      },
      {
        "Id": "4d1b-2617-ebdc-4f4d"
      },
      {
        "Id": "a230-c540-6a65-4974"
      },
      {
        "Id": "e351-bbd6-f470-b604"
      },
      {
        "Id": "3f0e-1dc6-b425-bf59"
      },
      {
        "Id": "77ca-5e-3d5e-ead5"
      },
      {
        "Id": "6d4a-7733-d725-a267"
      },
      {
        "Id": "dbb2-4d85-84c2-528c"
      },
      {
        "Id": "8997-c74d-3a8d-ecf9"
      }
    ]
  }
]