[
  {
    "Id": "68357f6a790d8280c4b24070",
    "Name": "Great Khan",
    "Type": "Profile",
    "BaseId": "4",
    "Children": [
      {
        "Id": "statline_854"
      },
      {
        "Id": "statline_855"
      },
      {
        "Id": "statline_856"
      }
    ]
  },
  {
    "Id": "68357f6a790d8280c4b240d1",
    "Name": "Khan",
    "Type": "Profile",
    "BaseId": "4",
    "Children": [
      {
        "Id": "statline_857"
      },
      {
        "Id": "statline_858"
      },
      {
        "Id": "statline_859"
      }
    ]
  },
  {
    "Id": "68357f6a790d8280c4b2413e",
    "Name": "Shaman",
    "Type": "Profile",
    "BaseId": "4",
    "Children": [
      {
        "Id": "statline_860"
      },
      {
        "Id": "statline_861"
      },
      {
        "Id": "statline_862"
      }
    ]
  },
  {
    "Id": "68357f6a790d8280c4b2419b",
    "Name": "Mammoth Hunter",
    "Type": "Profile",
    "BaseId": "4",
    "Children": [
      {
        "Id": "statline_863"
      },
      {
        "Id": "statline_864"
      },
      {
        "Id": "statline_865"
      }
    ]
  },
  {
    "Id": "b7da4115-8155-4eb6-b11a-45aa67ffe740",
    "Name": "Mammoth Hunter on Tusker",
    "Type": "Profile",
    "BaseId": "2",
    "Children": [
      {
        "Id": "statline_866"
      },
      {
        "Id": "statline_867"
      },
      {
        "Id": "statline_865"
      },
      {
        "Id": "statline_868"
      }
    ]
  },
  {
    "Id": "9ada8cec-bbc7-496f-aebc-4c7d12055ee2",
    "Name": "Mammoth Hunter on Rock Aurochs",
    "Type": "Profile",
    "BaseId": "14",
    "Children": [
      {
        "Id": "statline_869"
      },
      {
        "Id": "statline_870"
      },
      {
        "Id": "statline_865"
      },
      {
        "Id": "statline_871"
      }
    ]
  },
  {
    "Id": "e3d1f5b7a2c8d4f9a7c3e6b2d",
    "Name": "Ganzorig Ironbond",
    "Type": "Profile",
    "BaseId": "4",
    "Children": [
      {
        "Id": "statline_872"
      },
      {
        "Id": "statline_873"
      },
      {
        "Id": "statline_874"
      }
    ]
  },
  {
    "Id": "b2d8a3f6c1e7d9b5c4a2f8e9c",
    "Name": "Valish, the Chefling",
    "Type": "Profile",
    "BaseId": "16",
    "Children": [
      {
        "Id": "statline_875"
      },
      {
        "Id": "statline_876"
      },
      {
        "Id": "statline_877"
      },
      {
        "Id": "statline_878"
      },
      {
        "Id": "statline_879"
      }
    ]
  },
  {
    "Id": "68357f6b790d8280c4b242f6",
    "Name": "Tribesmen",
    "Type": "Profile",
    "BaseId": "4",
    "Children": [
      {
        "Id": "statline_880"
      },
      {
        "Id": "statline_881"
      },
      {
        "Id": "statline_882"
      }
    ]
  },
  {
    "Id": "68357f6b790d8280c4b24332",
    "Name": "Bruisers",
    "Type": "Profile",
    "BaseId": "4",
    "Children": [
      {
        "Id": "statline_883"
      },
      {
        "Id": "statline_884"
      },
      {
        "Id": "statline_885"
      }
    ]
  },
  {
    "Id": "68357f6b790d8280c4b24365",
    "Name": "Scraplings",
    "Type": "Profile",
    "BaseId": "5",
    "Children": [
      {
        "Id": "statline_886"
      },
      {
        "Id": "statline_887"
      },
      {
        "Id": "statline_888"
      }
    ]
  },
  {
    "Id": "68357f6c790d8280c4b24459",
    "Name": "Sabretooth Tigers",
    "Type": "Profile",
    "BaseId": "3",
    "Children": [
      {
        "Id": "statline_889"
      },
      {
        "Id": "statline_890"
      },
      {
        "Id": "statline_891"
      }
    ]
  },
  {
    "Id": "68357f6c790d8280c4b2444b",
    "Name": "Scrapling Trappers",
    "Type": "Profile",
    "BaseId": "5",
    "Children": [
      {
        "Id": "statline_892"
      },
      {
        "Id": "statline_893"
      },
      {
        "Id": "statline_894"
      }
    ]
  },
  {
    "Id": "68357f6c790d8280c4b2443d",
    "Name": "Yetis",
    "Type": "Profile",
    "BaseId": "4",
    "Children": [
      {
        "Id": "statline_895"
      },
      {
        "Id": "statline_896"
      },
      {
        "Id": "statline_897"
      }
    ]
  },
  {
    "Id": "68357f6d790d8280c4b2445c",
    "Name": "Kin-Eater",
    "Type": "Profile",
    "BaseId": "4",
    "Children": [
      {
        "Id": "statline_898"
      },
      {
        "Id": "statline_899"
      },
      {
        "Id": "statline_900"
      }
    ]
  },
  {
    "Id": "68357f6c790d8280c4b24401",
    "Name": "Tusker Cavalry",
    "Type": "Profile",
    "BaseId": "2",
    "Children": [
      {
        "Id": "statline_901"
      },
      {
        "Id": "statline_902"
      },
      {
        "Id": "statline_903"
      },
      {
        "Id": "statline_868"
      }
    ]
  },
  {
    "Id": "68357f6c790d8280c4b243a7",
    "Name": "Mercenary Veterans",
    "Type": "Profile",
    "BaseId": "4",
    "Children": [
      {
        "Id": "statline_904"
      },
      {
        "Id": "statline_905"
      },
      {
        "Id": "statline_906"
      }
    ]
  },
  {
    "Id": "68357f6d790d8280c4b2445f",
    "Name": "Mercenary Gunners",
    "Type": "Profile",
    "BaseId": "4",
    "Children": [
      {
        "Id": "statline_907"
      },
      {
        "Id": "statline_908"
      },
      {
        "Id": "statline_909"
      }
    ]
  },
  {
    "Id": "68357f6d790d8280c4b244ac",
    "Name": "Bombardiers",
    "Type": "Profile",
    "BaseId": "4",
    "Children": [
      {
        "Id": "statline_910"
      },
      {
        "Id": "statline_911"
      },
      {
        "Id": "statline_912"
      }
    ]
  },
  {
    "Id": "68357f6d790d8280c4b244a8",
    "Name": "Thunder Cannon",
    "Type": "Profile",
    "BaseId": "2",
    "Children": [
      {
        "Id": "statline_913"
      },
      {
        "Id": "statline_914"
      },
      {
        "Id": "statline_915"
      },
      {
        "Id": "statline_916"
      },
      {
        "Id": "statline_917"
      }
    ]
  },
  {
    "Id": "68357f6d790d8280c4b244a9",
    "Name": "Scratapult",
    "Type": "Profile",
    "BaseId": "2",
    "Children": [
      {
        "Id": "statline_918"
      },
      {
        "Id": "statline_919"
      },
      {
        "Id": "statline_920"
      },
      {
        "Id": "statline_916"
      },
      {
        "Id": "statline_921"
      }
    ]
  },
  {
    "Id": "68357f6d790d8280c4b244dd",
    "Name": "Rock Aurochs",
    "Type": "Profile",
    "BaseId": "14",
    "Children": [
      {
        "Id": "statline_922"
      },
      {
        "Id": "statline_923"
      },
      {
        "Id": "statline_924"
      },
      {
        "Id": "statline_925"
      }
    ]
  },
  {
    "Id": "68357f6e790d8280c4b244e2",
    "Name": "Frost Mammoth",
    "Type": "Profile",
    "BaseId": "14",
    "Children": [
      {
        "Id": "statline_926"
      },
      {
        "Id": "statline_927"
      },
      {
        "Id": "statline_928"
      },
      {
        "Id": "statline_929"
      }
    ]
  },
  {
    "Id": "68357f6e790d8280c4b244e6",
    "Name": "Mercenary Giant",
    "Type": "Profile",
    "BaseId": "7",
    "Children": [
      {
        "Id": "statline_930"
      },
      {
        "Id": "statline_931"
      },
      {
        "Id": "statline_932"
      }
    ]
  }
]