[
  {
    "Id": "profile_910d-d973-82c-d2e3",
    "Name": "Kor'sarro Khan",
    "Type": "Profile",
    "Children": [
      {
        "Id": "statline_4006"
      },
      {
        "Id": "rule_143-1a21-8afb-16c4"
      },
      {
        "Id": "rule_bbb5-617e-a254-8463"
      },
      {
        "Id": "rule_90b4-a746-de9b-2df2"
      },
      {
        "Id": "rule_3b76-4053-ece9-6e7d"
      },
      {
        "Id": "rule_c6cc-c38c-dfe6-dbb8"
      },
      {
        "Id": "equipment_1764763557376"
      },
      {
        "Id": "51-8dfa-ba16-7fbe"
      },
      {
        "Id": "4f5f-4d11-33d3-dbca"
      }
    ],
    "BaseId": "4"
  },
  {
    "Id": "profile_52d8-ea22-6fc6-870a",
    "Name": "Suboden Khan",
    "Type": "Profile",
    "Children": [
      {
        "Id": "statline_4007"
      },
      {
        "Id": "rule_1336-8c9c-a513-990d"
      },
      {
        "Id": "rule_886d-0aad-f792-2794"
      },
      {
        "Id": "rule_fe8b-e1ef-ef3c-cced"
      },
      {
        "Id": "rule_3b76-4053-ece9-6e7d"
      },
      {
        "Id": "rule_c6cc-c38c-dfe6-dbb8"
      },
      {
        "Id": "2cbe-10b2-3653-4b55"
      },
      {
        "Id": "9c08-2084-dcaf-e1bb"
      },
      {
        "Id": "b145-0fd3-a52a-85d6"
      },
      {
        "Id": "c98a-50b1-63f7-0ea1"
      }
    ],
    "BaseId": "22"
  }
]
